mysql> show databases;
+---------------------------+
| Database                  |
+---------------------------+
| ecommerce                 |
| information_schema        |
| mysql                     |
| performance_schema        |
| sakila                    |
| student_management_system |
| sys                       |
| world                     |
+---------------------------+
8 rows in set (0.04 sec)

mysql> use ecommerce;
Database changed
mysql> show tables;
+---------------------+
| Tables_in_ecommerce |
+---------------------+
| customer            |
| orders              |
| product             |
+---------------------+
3 rows in set (0.01 sec)

mysql> desc customer;
+-------------+--------------+------+-----+---------+-------+
| Field       | Type         | Null | Key | Default | Extra |
+-------------+--------------+------+-----+---------+-------+
| customer_id | varchar(5)   | NO   | PRI | NULL    |       |
| name        | varchar(20)  | NO   |     | NULL    |       |
| city        | varchar(10)  | NO   |     | NULL    |       |
| email       | varchar(20)  | NO   |     | NULL    |       |
| address     | varchar(100) | NO   |     | NULL    |       |
| phone       | varchar(10)  | NO   |     | NULL    |       |
| pincode     | int          | NO   |     | NULL    |       |
+-------------+--------------+------+-----+---------+-------+
7 rows in set (0.01 sec)

mysql> select * from customer;
Empty set (0.01 sec)

mysql> insert into customer (customer_id, name, city, email, address, phone, pincode) values ('C101', 'amit', 'mumbai', 'amitsu05@gmail.com', 'shanker nagar airoli', '5865145755', 415520);
Query OK, 1 row affected (0.02 sec)

mysql> select * from customer;
+-------------+------+--------+--------------------+----------------------+------------+---------+
| customer_id | name | city   | email              | address              | phone      | pincode |
+-------------+------+--------+--------------------+----------------------+------------+---------+
| C101        | amit | mumbai | amitsu05@gmail.com | shanker nagar airoli | 5865145755 |  415520 |
+-------------+------+--------+--------------------+----------------------+------------+---------+
1 row in set (0.01 sec)

mysql> select customer_id, name from customer;
+-------------+------+
| customer_id | name |
+-------------+------+
| C101        | amit |
+-------------+------+
1 row in set (0.00 sec)

mysql> insert into customer values ('C102', 'ajay', 'bhandup', 'ajay@gmail.com', 'pratap nagar', '5454515596', 584562);
Query OK, 1 row affected (0.01 sec)

mysql> select * from customer;
+-------------+------+---------+--------------------+----------------------+------------+---------+
| customer_id | name | city    | email              | address              | phone      | pincode |
+-------------+------+---------+--------------------+----------------------+------------+---------+
| C101        | amit | mumbai  | amitsu05@gmail.com | shanker nagar airoli | 5865145755 |  415520 |
| C102        | ajay | bhandup | ajay@gmail.com     | pratap nagar         | 5454515596 |  584562 |
+-------------+------+---------+--------------------+----------------------+------------+---------+
2 rows in set (0.00 sec)

mysql> desc customer;
+-------------+--------------+------+-----+---------+-------+
| Field       | Type         | Null | Key | Default | Extra |
+-------------+--------------+------+-----+---------+-------+
| customer_id | varchar(5)   | NO   | PRI | NULL    |       |
| name        | varchar(20)  | NO   |     | NULL    |       |
| city        | varchar(10)  | NO   |     | NULL    |       |
| email       | varchar(20)  | NO   |     | NULL    |       |
| address     | varchar(100) | NO   |     | NULL    |       |
| phone       | varchar(10)  | NO   |     | NULL    |       |
| pincode     | int          | NO   |     | NULL    |       |
+-------------+--------------+------+-----+---------+-------+
7 rows in set (0.01 sec)

mysql> alter table customer modify customer_id varchar(10) not null;
Query OK, 0 rows affected (0.06 sec)
Records: 0  Duplicates: 0  Warnings: 0

mysql> desc customer;
+-------------+--------------+------+-----+---------+-------+
| Field       | Type         | Null | Key | Default | Extra |
+-------------+--------------+------+-----+---------+-------+
| customer_id | varchar(10)  | NO   | PRI | NULL    |       |
| name        | varchar(20)  | NO   |     | NULL    |       |
| city        | varchar(10)  | NO   |     | NULL    |       |
| email       | varchar(20)  | NO   |     | NULL    |       |
| address     | varchar(100) | NO   |     | NULL    |       |
| phone       | varchar(10)  | NO   |     | NULL    |       |
| pincode     | int          | NO   |     | NULL    |       |
+-------------+--------------+------+-----+---------+-------+
7 rows in set (0.00 sec)

mysql> alter table customer add bill int not null;
Query OK, 0 rows affected (0.03 sec)
Records: 0  Duplicates: 0  Warnings: 0

mysql> desc customer;
+-------------+--------------+------+-----+---------+-------+
| Field       | Type         | Null | Key | Default | Extra |
+-------------+--------------+------+-----+---------+-------+
| customer_id | varchar(10)  | NO   | PRI | NULL    |       |
| name        | varchar(20)  | NO   |     | NULL    |       |
| city        | varchar(10)  | NO   |     | NULL    |       |
| email       | varchar(20)  | NO   |     | NULL    |       |
| address     | varchar(100) | NO   |     | NULL    |       |
| phone       | varchar(10)  | NO   |     | NULL    |       |
| pincode     | int          | NO   |     | NULL    |       |
| bill        | int          | NO   |     | NULL    |       |
+-------------+--------------+------+-----+---------+-------+
8 rows in set (0.00 sec)

mysql> alter table customer change column name customer_name varchar(20) not null;
Query OK, 0 rows affected (0.03 sec)
Records: 0  Duplicates: 0  Warnings: 0

mysql> desc customer;
+---------------+--------------+------+-----+---------+-------+
| Field         | Type         | Null | Key | Default | Extra |
+---------------+--------------+------+-----+---------+-------+
| customer_id   | varchar(10)  | NO   | PRI | NULL    |       |
| customer_name | varchar(20)  | NO   |     | NULL    |       |
| city          | varchar(10)  | NO   |     | NULL    |       |
| email         | varchar(20)  | NO   |     | NULL    |       |
| address       | varchar(100) | NO   |     | NULL    |       |
| phone         | varchar(10)  | NO   |     | NULL    |       |
| pincode       | int          | NO   |     | NULL    |       |
| bill          | int          | NO   |     | NULL    |       |
+---------------+--------------+------+-----+---------+-------+
8 rows in set (0.00 sec)

mysql> desc orders;
+--------------+-------------+------+-----+---------+----------------+
| Field        | Type        | Null | Key | Default | Extra          |
+--------------+-------------+------+-----+---------+----------------+
| order_id     | int         | NO   | PRI | NULL    | auto_increment |
| customer_id  | varchar(5)  | NO   | MUL | NULL    |                |
| product_id   | varchar(5)  | NO   | MUL | NULL    |                |
| quantity     | int         | NO   |     | NULL    |                |
| total_price  | double      | NO   |     | NULL    |                |
| payment_mode | varchar(20) | NO   |     | NULL    |                |
| order_date   | date        | NO   |     | NULL    |                |
| order_status | varchar(20) | NO   |     | NULL    |                |
+--------------+-------------+------+-----+---------+----------------+
8 rows in set (0.00 sec)

mysql> select * from customer;
+-------------+---------------+---------+--------------------+----------------------+------------+---------+------+
| customer_id | customer_name | city    | email              | address              | phone      | pincode | bill |
+-------------+---------------+---------+--------------------+----------------------+------------+---------+------+
| C101        | amit          | mumbai  | amitsu05@gmail.com | shanker nagar airoli | 5865145755 |  415520 |    0 |
| C102        | ajay          | bhandup | ajay@gmail.com     | pratap nagar         | 5454515596 |  584562 |    0 |
+-------------+---------------+---------+--------------------+----------------------+------------+---------+------+
2 rows in set (0.00 sec)

mysql> create table demo(id varchar(10) primary key not null, name varchar(20) not null);
Query OK, 0 rows affected (0.04 sec)

mysql> desc demo;
+-------+-------------+------+-----+---------+-------+
| Field | Type        | Null | Key | Default | Extra |
+-------+-------------+------+-----+---------+-------+
| id    | varchar(10) | NO   | PRI | NULL    |       |
| name  | varchar(20) | NO   |     | NULL    |       |
+-------+-------------+------+-----+---------+-------+
2 rows in set (0.01 sec)

mysql> insert into demo values('101', 'surya'),('102', 'ganu');
Query OK, 2 rows affected (0.01 sec)
Records: 2  Duplicates: 0  Warnings: 0

mysql> select * from demo;
+-----+-------+
| id  | name  |
+-----+-------+
| 101 | surya |
| 102 | ganu  |
+-----+-------+
2 rows in set (0.00 sec)

mysql> delete  from demo where id = '101';
Query OK, 1 row affected (0.01 sec)

mysql> select * from demo;
+-----+------+
| id  | name |
+-----+------+
| 102 | ganu |
+-----+------+
1 row in set (0.00 sec)

mysql> truncate table demo;
Query OK, 0 rows affected (0.03 sec)

mysql> desc demo;
+-------+-------------+------+-----+---------+-------+
| Field | Type        | Null | Key | Default | Extra |
+-------+-------------+------+-----+---------+-------+
| id    | varchar(10) | NO   | PRI | NULL    |       |
| name  | varchar(20) | NO   |     | NULL    |       |
+-------+-------------+------+-----+---------+-------+
2 rows in set (0.00 sec)

mysql> drop table demo;
Query OK, 0 rows affected (0.02 sec)

mysql> desc demo;
ERROR 1146 (42S02): Table 'ecommerce.demo' doesn't exist
mysql>


