mysql> use ecommerce;
Database changed
mysql> select * from customer;
+-------------+---------------+---------+--------------------+----------------------+------------+---------+------+
| customer_id | customer_name | city    | email              | address              | phone      | pincode | bill |
+-------------+---------------+---------+--------------------+----------------------+------------+---------+------+
| C101        | amit          | mumbai  | amitsu05@gmail.com | shanker nagar airoli | 5865145755 |  415520 |    0 |
| C102        | ajay          | bhandup | ajay@gmail.com     | pratap nagar         | 5454515596 |  584562 |    0 |
+-------------+---------------+---------+--------------------+----------------------+------------+---------+------+
2 rows in set (0.03 sec)

mysql> show tables;
+---------------------+
| Tables_in_ecommerce |
+---------------------+
| customer            |
| orders              |
| product             |
+---------------------+
3 rows in set (0.05 sec)

mysql> update customer set phone = '9921654289' where customer_id = 'C101';
Query OK, 1 row affected (0.03 sec)
Rows matched: 1  Changed: 1  Warnings: 0

mysql> select * from customer;
+-------------+---------------+---------+--------------------+----------------------+------------+---------+------+
| customer_id | customer_name | city    | email              | address              | phone      | pincode | bill |
+-------------+---------------+---------+--------------------+----------------------+------------+---------+------+
| C101        | amit          | mumbai  | amitsu05@gmail.com | shanker nagar airoli | 9921654289 |  415520 |    0 |
| C102        | ajay          | bhandup | ajay@gmail.com     | pratap nagar         | 5454515596 |  584562 |    0 |
+-------------+---------------+---------+--------------------+----------------------+------------+---------+------+
2 rows in set (0.00 sec)
 
# USE PERCENTAGE

mysql> select * from customer where customer_name like '%al';
Empty set (0.00 sec)

mysql> select * from customer where customer_name like '%it';
+-------------+---------------+--------+--------------------+----------------------+------------+---------+------+
| customer_id | customer_name | city   | email              | address              | phone      | pincode | bill |
+-------------+---------------+--------+--------------------+----------------------+------------+---------+------+
| C101        | amit          | mumbai | amitsu05@gmail.com | shanker nagar airoli | 9921654289 |  415520 |    0 |
+-------------+---------------+--------+--------------------+----------------------+------------+---------+------+
1 row in set (0.00 sec)

mysql> select * from customer where customer_name like '%ja%';
+-------------+---------------+---------+----------------+--------------+------------+---------+------+
| customer_id | customer_name | city    | email          | address      | phone      | pincode | bill |
+-------------+---------------+---------+----------------+--------------+------------+---------+------+
| C102        | ajay          | bhandup | ajay@gmail.com | pratap nagar | 5454515596 |  584562 |    0 |
+-------------+---------------+---------+----------------+--------------+------------+---------+------+
1 row in set (0.00 sec)

mysql> select * from customer where city like 'm%';
+-------------+---------------+--------+--------------------+----------------------+------------+---------+------+
| customer_id | customer_name | city   | email              | address              | phone      | pincode | bill |
+-------------+---------------+--------+--------------------+----------------------+------------+---------+------+
| C101        | amit          | mumbai | amitsu05@gmail.com | shanker nagar airoli | 9921654289 |  415520 |    0 |
+-------------+---------------+--------+--------------------+----------------------+------------+---------+------+
1 row in set (0.00 sec)

mysql> select * from customer where customer_name like 'a___';
+-------------+---------------+---------+--------------------+----------------------+------------+---------+------+
| customer_id | customer_name | city    | email              | address              | phone      | pincode | bill |
+-------------+---------------+---------+--------------------+----------------------+------------+---------+------+
| C101        | amit          | mumbai  | amitsu05@gmail.com | shanker nagar airoli | 9921654289 |  415520 |    0 |
| C102        | ajay          | bhandup | ajay@gmail.com     | pratap nagar         | 5454515596 |  584562 |    0 |
+-------------+---------------+---------+--------------------+----------------------+------------+---------+------+
2 rows in set (0.00 sec)


mysql> insert into customer values('C103', 'aakash', 'thane', 'aandy@gmail.com', 'ganesh nagar', '5467454574', 245124, 0);
Query OK, 1 row affected (0.01 sec)

mysql> INSERT INTO customer VALUES
    -> ('C104', 'Priya', 'Mumbai', 'priyaa@gmail.com', 'Andheri West', '9876543210', 245125, 1),
    -> ('C105', 'Rahul', 'Pune', 'rahul@gmail.com', 'Shivaji Nagar', '9123456780', 245126, 0),
    -> ('C106', 'Sneha', 'Nashik', 'snehai@gmail.com', 'College Road', '9988776655', 245127, 1),
    -> ('C107', 'Vikram', 'Nagpur', 'vikram.d@gmail.com', 'Sitabuldi', '9012345678', 245128, 0),
    -> ('C108', 'Neha', 'Aurangabad', 'neha.k@gmail.com', 'CIDCO', '9090909090', 245129, 1);
Query OK, 5 rows affected (0.01 sec)
Records: 5  Duplicates: 0  Warnings: 0

mysql> select * from customer;
+-------------+---------------+------------+--------------------+----------------------+------------+---------+------+
| customer_id | customer_name | city       | email              | address              | phone      | pincode | bill |
+-------------+---------------+------------+--------------------+----------------------+------------+---------+------+
| C101        | amit          | mumbai     | amitsu05@gmail.com | shanker nagar airoli | 9921654289 |  415520 |    0 |
| C102        | ajay          | bhandup    | ajay@gmail.com     | pratap nagar         | 5454515596 |  584562 |    0 |
| C103        | aakash        | thane      | aandy@gmail.com    | ganesh nagar         | 5467454574 |  245124 |    0 |
| C104        | Priya         | Mumbai     | priyaa@gmail.com   | Andheri West         | 9876543210 |  245125 |    1 |
| C105        | Rahul         | Pune       | rahul@gmail.com    | Shivaji Nagar        | 9123456780 |  245126 |    0 |
| C106        | Sneha         | Nashik     | snehai@gmail.com   | College Road         | 9988776655 |  245127 |    1 |
| C107        | Vikram        | Nagpur     | vikram.d@gmail.com | Sitabuldi            | 9012345678 |  245128 |    0 |
| C108        | Neha          | Aurangabad | neha.k@gmail.com   | CIDCO                | 9090909090 |  245129 |    1 |
+-------------+---------------+------------+--------------------+----------------------+------------+---------+------+
8 rows in set (0.00 sec)

# USE LIMIT 

mysql> select * from customer limit 3;
+-------------+---------------+---------+--------------------+----------------------+------------+---------+------+
| customer_id | customer_name | city    | email              | address              | phone      | pincode | bill |
+-------------+---------------+---------+--------------------+----------------------+------------+---------+------+
| C101        | amit          | mumbai  | amitsu05@gmail.com | shanker nagar airoli | 9921654289 |  415520 |    0 |
| C102        | ajay          | bhandup | ajay@gmail.com     | pratap nagar         | 5454515596 |  584562 |    0 |
| C103        | aakash        | thane   | aandy@gmail.com    | ganesh nagar         | 5467454574 |  245124 |    0 |
+-------------+---------------+---------+--------------------+----------------------+------------+---------+------+
3 rows in set (0.00 sec)

# USE DISTINCT

mysql> select distinct city from customer;
+------------+
| city       |
+------------+
| mumbai     |
| bhandup    |
| thane      |
| Pune       |
| Nashik     |
| Nagpur     |
| Aurangabad |
+------------+
7 rows in set (0.01 sec)

mysql> select * from product;
Empty set (0.05 sec)

mysql> desc product;
+----------------+-------------+------+-----+---------+-------+
| Field          | Type        | Null | Key | Default | Extra |
+----------------+-------------+------+-----+---------+-------+
| product_id     | varchar(5)  | NO   | PRI | NULL    |       |
| product_name   | varchar(20) | NO   |     | NULL    |       |
| category       | varchar(20) | NO   |     | NULL    |       |
| sub_category   | varchar(20) | NO   |     | NULL    |       |
| original_price | double      | NO   |     | NULL    |       |
| selling_price  | double      | NO   |     | NULL    |       |
| stock          | varchar(20) | NO   |     | NULL    |       |
+----------------+-------------+------+-----+---------+-------+
7 rows in set (0.02 sec)

# USE AND , OR OPERATOR

mysql> select * from customer where customer_name = 'amit' and bill = 1;
Empty set (0.00 sec)

mysql> select * from customer where customer_name = 'amit' or bill = 1;
+-------------+---------------+------------+--------------------+----------------------+------------+---------+------+
| customer_id | customer_name | city       | email              | address              | phone      | pincode | bill |
+-------------+---------------+------------+--------------------+----------------------+------------+---------+------+
| C101        | amit          | mumbai     | amitsu05@gmail.com | shanker nagar airoli | 9921654289 |  415520 |    0 |
| C104        | Priya         | Mumbai     | priyaa@gmail.com   | Andheri West         | 9876543210 |  245125 |    1 |
| C106        | Sneha         | Nashik     | snehai@gmail.com   | College Road         | 9988776655 |  245127 |    1 |
| C108        | Neha          | Aurangabad | neha.k@gmail.com   | CIDCO                | 9090909090 |  245129 |    1 |
+-------------+---------------+------------+--------------------+----------------------+------------+---------+------+
4 rows in set (0.00 sec)

# USE BETWEEN

mysql> select * from customer where customer_id between 'C102' and 'C105';
+-------------+---------------+---------+------------------+---------------+------------+---------+------+
| customer_id | customer_name | city    | email            | address       | phone      | pincode | bill |
+-------------+---------------+---------+------------------+---------------+------------+---------+------+
| C102        | ajay          | bhandup | ajay@gmail.com   | pratap nagar  | 5454515596 |  584562 |    0 |
| C103        | aakash        | thane   | aandy@gmail.com  | ganesh nagar  | 5467454574 |  245124 |    0 |
| C104        | Priya         | Mumbai  | priyaa@gmail.com | Andheri West  | 9876543210 |  245125 |    1 |
| C105        | Rahul         | Pune    | rahul@gmail.com  | Shivaji Nagar | 9123456780 |  245126 |    0 |
+-------------+---------------+---------+------------------+---------------+------------+---------+------+
4 rows in set (0.01 sec)

mysql> select * from customer where customer_id not between 'C102' and 'C105';
+-------------+---------------+------------+--------------------+----------------------+------------+---------+------+
| customer_id | customer_name | city       | email              | address              | phone      | pincode | bill |
+-------------+---------------+------------+--------------------+----------------------+------------+---------+------+
| C101        | amit          | mumbai     | amitsu05@gmail.com | shanker nagar airoli | 9921654289 |  415520 |    0 |
| C106        | Sneha         | Nashik     | snehai@gmail.com   | College Road         | 9988776655 |  245127 |    1 |
| C107        | Vikram        | Nagpur     | vikram.d@gmail.com | Sitabuldi            | 9012345678 |  245128 |    0 |
| C108        | Neha          | Aurangabad | neha.k@gmail.com   | CIDCO                | 9090909090 |  245129 |    1 |
+-------------+---------------+------------+--------------------+----------------------+------------+---------+------+
4 rows in set (0.00 sec)

# USE IN and NOT IN

mysql> select * from customer where customer_id in ('C101', 'C104', 'C108');
+-------------+---------------+------------+--------------------+----------------------+------------+---------+------+
| customer_id | customer_name | city       | email              | address              | phone      | pincode | bill |
+-------------+---------------+------------+--------------------+----------------------+------------+---------+------+
| C101        | amit          | mumbai     | amitsu05@gmail.com | shanker nagar airoli | 9921654289 |  415520 |    0 |
| C104        | Priya         | Mumbai     | priyaa@gmail.com   | Andheri West         | 9876543210 |  245125 |    1 |
| C108        | Neha          | Aurangabad | neha.k@gmail.com   | CIDCO                | 9090909090 |  245129 |    1 |
+-------------+---------------+------------+--------------------+----------------------+------------+---------+------+
3 rows in set (0.00 sec)

mysql> select * from customer where customer_id not in ('C101', 'C104', 'C108');
+-------------+---------------+---------+--------------------+---------------+------------+---------+------+
| customer_id | customer_name | city    | email              | address       | phone      | pincode | bill |
+-------------+---------------+---------+--------------------+---------------+------------+---------+------+
| C102        | ajay          | bhandup | ajay@gmail.com     | pratap nagar  | 5454515596 |  584562 |    0 |
| C103        | aakash        | thane   | aandy@gmail.com    | ganesh nagar  | 5467454574 |  245124 |    0 |
| C105        | Rahul         | Pune    | rahul@gmail.com    | Shivaji Nagar | 9123456780 |  245126 |    0 |
| C106        | Sneha         | Nashik  | snehai@gmail.com   | College Road  | 9988776655 |  245127 |    1 |
| C107        | Vikram        | Nagpur  | vikram.d@gmail.com | Sitabuldi     | 9012345678 |  245128 |    0 |
+-------------+---------------+---------+--------------------+---------------+------------+---------+------+
5 rows in set (0.00 sec)

# IS OPERATOR

mysql> select * from customer where email is null;
Empty set (0.01 sec)

mysql> select * from customer where email is not null;
+-------------+---------------+------------+--------------------+----------------------+------------+---------+------+
| customer_id | customer_name | city       | email              | address              | phone      | pincode | bill |
+-------------+---------------+------------+--------------------+----------------------+------------+---------+------+
| C101        | amit          | mumbai     | amitsu05@gmail.com | shanker nagar airoli | 9921654289 |  415520 |    0 |
| C102        | ajay          | bhandup    | ajay@gmail.com     | pratap nagar         | 5454515596 |  584562 |    0 |
| C103        | aakash        | thane      | aandy@gmail.com    | ganesh nagar         | 5467454574 |  245124 |    0 |
| C104        | Priya         | Mumbai     | priyaa@gmail.com   | Andheri West         | 9876543210 |  245125 |    1 |
| C105        | Rahul         | Pune       | rahul@gmail.com    | Shivaji Nagar        | 9123456780 |  245126 |    0 |
| C106        | Sneha         | Nashik     | snehai@gmail.com   | College Road         | 9988776655 |  245127 |    1 |
| C107        | Vikram        | Nagpur     | vikram.d@gmail.com | Sitabuldi            | 9012345678 |  245128 |    0 |
| C108        | Neha          | Aurangabad | neha.k@gmail.com   | CIDCO                | 9090909090 |  245129 |    1 |
+-------------+---------------+------------+--------------------+----------------------+------------+---------+------+
8 rows in set (0.01 sec)

mysql>

